product_code,liking,liking_free_text,meets_expectation,meets_expectation_free_text,product_improvement_free_text
802,2,"I like the appearance of the product. The seeds and nuts. However, it does not have a sweet or savory taste to it. It's as though it is missing something. There is a strange after taste after eating the product as well. I am not sure if it is the nuts, seed or light BBQ that gives that taste. I don't like it.",2,"I like BBQ and I like nuts; however, the combination together is a no.",I would make this product either sweeter adding some fruits (cranberries or raisin) or more of a BBQ taste.
581,1,The crunchy is great. I also like that I can see the seeds and peanuts.,1,I didn’t like this bar at all. It left a bitter aftertaste in my mouth.,The smokeness is too much for me.
623,6,The texture and it doesn’t leave a bitter taste in my mouth.,3,This bar is okay. It can be better.,I would get rid of the heat in it. It also needs more sweetness.
802,6,The crunch is very good. I also like the nuts and seeds.,2,The barbecue flavor doesn’t taste good.,The barbecue flavor tastes plasticky to me. I don’t like it.
581,6,It’s got a sweet aspect to it. And not too bbq flavored compared to the last one.,4,It’s got that sweet aspect,Stronger flavor
623,4,It’s got a nice flavor to it,3,It tasted like you’d think it would.,A more distinct flavor would be nice. It tasted like Chex mix to me.
802,4,I just personally don’t really like BBQ flavored things.,3,It’s a good product. I’m just not much for BBQ flavor in general.,"I mean it’s not a bad product, maybe add some other flavors."
581,6,Crunchy,3,BBQ crunchy bar,More savory flavors
623,6,Crunchy,3,"Hard to capture bbq flavor, so I wasn’t surprised",More flavor
802,4,Crunchiness,3,Name clued me in to what it may taste like,More savory
581,2,I like the crunchy texture,2,BBQ flavor was too over powering and didn't mix well with other ingredients,Flavors did not mix well together
623,3,The texture and crunch,2,The flavors didn't go well together and the BBQ flavor was too much,The BBQ flavor is too much with other ingredients
802,1,I like the crunchiness of it,2,The BBQ flavor was too much.,On paper the ingredients sound good together but did not taste well together. Think there was too much BBQ flavor
581,8,The taste was amazing! I loved the crunchiness also!,4,This product was exactly what I thought it would be and more! I love the flavor!,Add more sweetness
623,2,Did not like the taste nor the crunchiness. The appearance was appealing,2,Did not expect it to taste the way it did,Taste and flavor
802,2,The appearance of the product is acceptable.,1,I did not like the taste of the product.,The taste overall.
581,1,"Although this bar tastes slightly less smoky, it still has a flat, unsatisfactory taste and profile. Again - more honey, sweet flavors are needed.",2,Not a flavor I would expect from Nature Valley. The crunchy and wholesome factors are still present and familiar.,More honey and sweet notes.
623,1,"Flavor profile is too smoky and flat, unsatisfactory aftertaste. Needs a less smoky and BBQ flavor and more honey, sweet flavors.",2,Not the flavor combination or profile I would expect. Honestly it tastes cheap and uninspired. Similar to a quick stop snack I can purchase that is not a trusted name brand.,"Needs a less smoky and BBQ flavor and more honey, sweet flavors. Overall I do not think this was a great idea for a Nature Valley bar. The BBQ is not interesting."
802,1,The smoky taste is overwhelming; after taste is displeasing; flavors profile is confusing at times; does not sit well with my aesthetic when it comes to nut bars and flavor,1,"I'm a fan of Nature Valley but I'm not at all pleased by this bar. As stated before, smoke flavor is too much. I would like to have more of the sweet and honey flavor that Nature Valley does well.",I don't think you can make this Smoky BBQ flavored bar better in my opinion; I would more than likely not eat a nut bar flavored like BBQ - possibly lessen the smokey flavor and increase the sweet additive - maybe a slight bit of honey
581,6,I guess since it is subtle between sweet and savory,2,I was underwhelmed with the flavor.  I think their other bars are much better,"It has an aftertaste - it needs a bit more spice or go in the other direction with sweetness, like maple.  Add tomato and salt flavors and maybe pepper"
623,6,It's a nice tangy sweet mix,3,"I was not sure what the mix was going to be but the second time I tried it, it was better.","probably add a bit of tomato, saltiness and pepper to it"
802,4,Interesting taste at first in terms of the spiciness,2,It looked appetizing but needs a better taste combination - maybe introduce a tomato flavor more or go sweeter,"It has an aftertaste, so maybe increase the sweet ingredients"
581,9,"I like the smell of the product, the appearance looks very  natural  and the texture and flavor are very nice",5,"nice size, and not too crunchy and no weird aftertaste",more flavor
623,9,"I like the smell of the product, the appearance looks very  natural  and the texture and flavor are very nice",5,"it is a very nice sensory snack. good flavor, smell, texture, appearance",more flavor
802,9,"I like the smell of the product, the appearance looks very  natural  and the texture and flavor are very nice",5,Its not a difficult bar to bite into - its crunchy but its not a rock hard bar.,maybe increase the flavor a little bit
581,3,"The crunch, texture and size. I like the ingredients in it other then the BBQ",2,maybe i dont really know what my expecations were since a BBQ granola bar is as whole new concept to me. but in the end I think of my granola bars being sweet and a breakfast item rather than tangy and spicey,"I weoudl take out the BBQ, jsut stick with the honey, cinnamon type of flavors"
623,3,I like the crunch. I like the granola and nuts in it as well as the size of the product.,2,"I just think of sweet when i have a granola or poteien, energy or breakfast bar. So i as going in for something sweet and it was realy just too spcky for my liking in the bar form, it would be better as a snack mix",I really just dont like the BBQ flavor to be honest. It just seemed and odd combination  personally
802,4,The crunch is really good an the more you eat it the more you get used to it. It has a nice balance of sweet and savory and feels like it should be healthy,2,i just thought it would be a more mild bbq. I also expect granola bars to be sweet so it was taken off guard,it jsut personally dont like the BBQ it was too tangy and made and at all breakfasty which is when i like to eat my granola bars
581,9,"I really like the flavor and crunch, number 2/3 for me",5,"I had no clue what to expect, but this was really good!",I think a little less crunch would be good
623,8,"I like the crunch on this one and the flavor is very good, this is 3/3 for me",5,"I had no idea what to expect, but these are great!",I think there needs to be a bit more BBQ flavor on this one.
802,9,"I love the flavor and the texture, it's not too strong, but taste great, my favorite of the 3",5,"I was not sure what to expect, but I can see having a box of these in my office as a snack.",I would change nothing!
581,6,The BBQ flavor is there but is not too overpowering and you taste it more so as you eat it as opposed to it instantly hitting your tongue as soon as you bite it.,3,When I think of BBQ flavor this bar is the taste that I would expect with the exception of the it being a little too salty.,Not make is as salty.
623,3,It has a crunch but also some softness from the peanuts. The BBQ flavor is a little more mild.,2,The BBQ flavor is very strong and it leaves a salty flavor in my mouth.,I would not make it as salty.
802,3,"I like that it's small for on the go purposes, usually I am up for work around 5am and I like to grab granola bars on my way out the door to eat on my way to work. I also like the crunchy texture of the bar.",2,I do love BBQ flavors but this is not something that I would eat super early in the morning on my way to work as BBQ is not a flavor I crave for breakfast.,The BBQ flavor is very over powering and strong that it made me thirsty almost instantly.
581,4,The presentation,3,BBQ tastes good but not on or in everything,make the size slightly bigger
623,5,Just the appearance,2,it did not make my tastes buds tingle,I would add honey
802,6,The salty taste,3,smokey BBQ speaks for itself,adding honey
581,5,The bar tastes like many of the other Nature Valley bars I have had.  The taste has the consistency I like without having the awful aftertaste I sometimes get.,3,For a BBQ flavored product I find the consistency of the BBQ throughout to be perfect.,I would increase the secondary flavors to give it a deeper taste.
623,5,It has a consistent taste throughout that was not over the top.,3,The flavor was consistent and I like consistency vs over the top flavors,I think it’s needs more nuts
802,2,The tastes are not something I am looking for in a bar.,1,I do not want to have BBQ flavoring in a nature valley bar and this product confirms it.,I do not think anything can change it so I will like it.
581,5,It has a certain spice flavor like a chipotle flavor. Not much BBQ but I somewhat enjoy it. If the BBQ flavor was increased and was a bit more compact it would be good.,3,It was not my top 2 choices but once retried. The flavor was not terrible. I did not hold high expectations due to texture and appearance.,Increase the BBQ flavor and adjust the appearance.
623,4,I like the crunch more than the rest. Not sure what is different but it is a bit harder. It being compacted more possibly increases the crunch.,4,The appearance is better and the crunch is nice. Seems to be maybe more compacted. It was close to perfect minus additional flavor.,The taste should have more BBQ flavor. The appearance and crunch are great. Just not as satisfying in BBQ flavor.
802,7,"I feel with product 802 you can taste what is advertised. The BBQ flavor, richness, and crunch, are well-balanced but not overpowering. It is my first pick versus the other two product choices.",5,"As stated earlier, it is what I would expect it to taste like. The BBQ flavor is there and crunches from the nuts. The sweetness and salt combination.",If the appearance can be a bit more appealing. Unsure how the process is to do so. But it is not the most appealing. Until you try the product then I know I enjoy it.
581,1,this item has a unique taste and is very chalky.,2,Just not the taste for me,definitely add some sugar to it
623,2,nothing its very chalky,2,this product is just not something i would purchase. its very dry and chalky,i would like to add some sweet to it
802,2,the taste is kind of funny. it is a strong taste,3,"after tasting the product again, it does have a savory taste inn which i would no buy for this type of product",possibly add a sweeter taste to it
581,6,"little heat in the aftertaste, crunchy, not too hard",3,it was tasty and crunchy like a typical nature valley bar.  flavors were good and had nice texture,more smoke flavor...maybe a little heat
623,4,"smoky flavor, crunchy, feels like a healthy snack",2,"the flavor wasn't well developed and didn't overwhelm me, seemed like the flavor faded quickly","tasted a little  greasy , also the flavor seemed to fade almost immediately...not smoky aftertaste and no heat"
802,8,has a smoky aftertaste with a little heat.  lots of peanuts.,4,"it tasted pretty good, the flavors were well developed.  typically, I enjoy nature valley so I expected to enjoy this.","on one side, you can see nuts, etc.  But if you flip it over, it looks like it's just flattened.  Also, breaks very easily."
581,2,"Nothing.  I don’t like the taste at all.  It’s not tasty at all.  I don’t taste bbq, but something like Smokey.  It’s not appetizing at all.",3,"It didn’t sound good, and it didn’t taste good at all.","Everything.  I don’t like the taste.  The texture isn’t bad, but I can’t get over the taste."
623,2,I don’t like the taste at all.  There not much taste to it but something Smokey.  Not liking that.  There’s not an overwhelming bbq taste.,3,I didn’t think it was going to taste very good and it didn’t.,Everything.  I don’t like the taste at all.  The appearance isn’t too bad.  It’s just not very tasty.
802,2,I don’t like the Smokey taste of the product.  In my mind I was thinking I was going to eat a granola bar so I was expecting sweet but that’s not what I got.  The taste is not good at all.,2,"I guess if you like bbq it might not be bad, but I don’t like the taste at all.  I expected something that tasted different.  Not sure what, but not this…",Everything.  I don’t like the taste or the appearance.  Yucky…
581,4,Nothing,2,I thought it would taste like the other bars but the flavor was off,"The taste, the texture"
623,6,The flavor,3,I expected it to be crunchy and savory and it was,I would make it less crunchy
802,5,The flavor,3,The title explains the bar really well it is savory and crunchy.,A little less crunchy
581,8,I like the texture and the flavor of the bar.,3,The flavor is what I would expect from a bbq flavored bar.,"The first bite is a little strong, if that was a little milder I think it would be better."
623,7,I like the texture and the flavor is a good balance of savory and sweet,4,"The bbq flavor is there, but it’s not overbearing so it still feels like a healthy snack and not chips","I think the after taste is a little strong, maybe make that a little milder"
802,4,I like the crunchiness of the product,4,"I didn’t expect the product to be good at all, but it was surprisingly tasty",The taste is a little to strong for me
581,8,I like how well so much crunchy ness is packed into such a small bar,4,I thought it would be hard and plain with slight bbq flavor and I was wrong,I would maybe add cashews
623,9,Is taste good and have a pleasant crunch to each bite.,4,Good size and color. The other reason is because it has good flavor,Add cashews
802,8,The flavor of the smoky bbq is delicious. The texture is nice and crunchy,5,I thought it would be plain. But is turned out to be amazing,Nothing
581,8,I like the bbq  flavor.,4,The bar tastes good.,I would add more nuts.
623,9,I like that the bar I'd crunchy.,5,The bar is crunchy.,I wouldn't change nothing.
802,8,I like that the bar is crunchy.,4,The bar is tasty and crunchy.,I would put less salt.
581,8,It has the right amount of BBQ and spiciness and the right amount of tang.,4,It has the right amount of BBQ and spice I did not expect.,Less crunchy.
623,7,I like the mild BBQ and spicy flavor and it has some tang.,3,It had the amount of spice and BBQ as expected.,A bit more BBQ and spice and more tang. Less crunchy.
802,7,I like the BBQ and mild spice and also the slight tang.,3,I thought it would be mild as far as spice and BBQ go.,"Make it more BBQ and more spicy, less crunchy."
581,6,I like that the peanut flavor is mixed with the BBQ flavor. And the BBQ flavor is not too overwhelming.,3,This is what I expect the bar to taste like.,The BBQ taste is a little more tangy than sweet.
623,4,The flavor of the BBQ is pretty strong. I'm not liking it as much as I thought I would.,2,I thought it would be more of a mix of flavors. It is pretty much all BBQ flavor.,Lessen the amount of the BBQ flavor
802,6,I like the chunks of peanuts in the bar and the tangy bbq flavor.,3,The flavor of the peanuts mixes with granola was what I expected. Also knowing it was BBQ flavored I expected that taste.,It does seem to break apart very easily.
581,7,good bbq taste,3,I like it,I like it
623,4,too smoky,2,I am not a fan of the taste or the after taste,less bbq smoky taste
802,5,crunchy,3,I was a fan of the smoky bbq flavor,too smoky
581,9,The flavor is like nothing I've ever tasted before,5,The nature Valley product just seems to keep getting better than ever. The balance is perfect,Nothing at all
623,9,The balance of flavors,5,I've tried others and this flavor profile is very unique,Nothing. Like it just as is
802,8,It's surprisingly burst of flavors,5,I like all of the nature Valley product. This one is very different than any other product like this,Nothing. I would definitely buy this product
581,7,"I like the BBQ flavor with the peanuts, and the texture",3,This is my third sample of the same flavor so I know what to expect.,It still has too much aftertaste and I don't have any craving to continue eating it.
623,7,I like the BBQ flavor combined with peanuts.,3,Second sample so I had a better idea of how this would taste,"I think it's giving too much of an aftertaste, not making me want to eat any more of it because the flavor is a little too much."
802,8,"I love the BBQ flavor with peanuts, also really like how you can taste the smoky flavor and a little bit of sweetness but not too much.",4,"I wasn't sure how BBQ bar would taste, I normally associate these types of products with breakfast",Maybe less peanuts
581,7,strong flavor,4,tastes better than it looks,nothing maybe bigger
623,7,the savory flavor,4,dont normally like bbq but this is good,make bigger
802,8,i like the smokey flavor and its crunchy,4,it had more flavor than i expected,bigger
581,8,I like the flavor of this product.  It's smoky bbq but not too strong and has a hint of sweetness to it.,4,I thought it would have a weird bbq flavor to it but it does not.,"Have pieces of the peanuts visable, the only seeds/nuts I could see while looking at it were sunflower seeds."
623,8,A hint of sweet.  I like the crunch mixed with the seed and nut flavor.,4,I was expecting an overbearing bbq flavor.  This one is subtle.,Make it not quite so crumbly.  This one made a big mess each bite I took.
802,9,"That you can see the seeds/nuts.  The crunch is great, not too hard to bite through.  You can taste a hint of the bbq flavor, it is not overpowering.",3,Its just as I imagined a bar of this name would taste.,Nothing to change in my opinion.
581,6,I liked the texture a lot. It was crunchy but not crumbly. The barbeque flavor was pleasant but weaker than I had hoped. The same for the smoky flavor. The aftertaste was present but not bad.,2,I expected something much more flavorful and not as bland. Other snack bars typically border on being almost too strong but this ones flavor definitely needed to be boosted a bit.,I would increase the amount of barbeque flavor and smoky flavor. This product did not have as strong of a peanut flavor so the barbeque flavor wasnt overpowered it was simply too weak. I otherwise really enjoyed this product but would not buy it due to the weakness of the flavor.
623,4,I like the barbeque flavors of this product and I enjoy the texture of this product.,2,I expected a bar that really accentuated the barbeque and smoky flavors and this bar did not do that for me at all.,The barbeque flavor is good but is very minimal. The smoky flavor of the previous bar is also not very strong. The peanut taste almost overpowers the barbeque flavors and makes the bar taste somewhat bland. The aftertaste is ok but this one seems to have something slightly spicier in it that I did not care for.
802,8,I like that the smoky flavor and the barbeque flavor really stand out against the peanut taste. The peanut taste is faint and does not overpower or hinder the barbeque flavor at all. The texture is nice and there is little to no aftertaste.,5,The moment I took a bite I was able to immediately notice the barbeque flavors and the smoky flavors in the bar. It did not taste bland or strange in any way.,There is not much that I can think of to change this product for the better. The physical appearance of the bar is fairly normal and boring when compared to the sweeter bars with chocolate and such in them but it is to be expected given the flavor of this bar and dont feel like it detracts from the enjoyment.
581,9,"It tastes like Lay's BBQ chips, but in a form of a delicious nut bar with better, crunchier texture of a nut bar.",5,"A savory nut bar is a new concept to me, and I had preconceived notions that BBQ-flavored nut bars wouldn't be tasty. This was a pleasant surprise.",Nothing - both flavor and texture were excellent.
623,7,"I like its savory taste and texture, though the taste doesn't stand out like the other bars.",4,"This is in line with the other bars: I didn't expect a savory taste to go so well with a nut bar, but it does.","I'm unsure how I'd change it to make this product better. It's a good product on its own, just doesn't stand out as much to me."
802,9,The flavor and the texture make this a perfect savory snack for me.,5,I didn't expect the taste to compliment the composition and the texture of the nut bar so well.,Nothing. It's delicious.
581,7,I like the smokey flavor.,4,I didn't think they could make a bar that was savory and make me want to keep eating it.,"I don't like the texture very much, it seems very brittle and kind of hard to bite."
623,7,The look of it.,3,"It tastes how I think it would. Not great, but not bad.",It is too dense and lacks as much flavor.
802,8,I like the light crisp crunch and the tang of flavor.,5,I like how the flavor snapped and it was crispy yet crunchy.,I wouldn't really change anything.
581,4,I do not like the barbeque flavoring.  It does not go well with the nutty crunchiness of the bar.,2,"I like BBQ chips so I thought I'd like this, however I don't.  The flavor is too strong and doesn't fit in this combination with nuts.",Make the flavoring much less noticeable.
623,3,The barbecue taste is a little too tangy.,3,The other samples tasted very similar so I expected this bar to taste this way.,Reduce the flavor.
802,4,I'm not a fan of the Barbeque flavor.  It's a bit too strong and doesn't go well with nuts.,3,The previous sample had a nearly identical taste so I expected the same with this bar.,Reduce the flavoring.
581,3,Too salty and smoky,2,I underestimated how much the BBQ would throw off the balance. When partaking in a Nature Valley Bar you do t expect to receive a taste liking to Barbecue chips,Decrease the BBQ flavoring  Add an additional element like another nut
623,7,This is a better combination of the ingredients and the best one so far,3,This meet my expectations exactly,Something to add to the texture   An additional ingredient or nut
802,4,Still too much BBQ flavor. It is better and not as salty but still over powers everything else.,3,This taste is closer to what I was expecting when thinking of a bbq crunch bar,Mute the BBQ flavor just a smidge
581,6,crunchy and nutty  peanuts are good,3,"I tasted BBQ, nuts and seeds",tastes a little too spicy BBQ
623,7,crunchy and salty.   has a nutty taste.,3,it was satisfying.  a nice texture and salty taste,make it more nutty
802,7,"It is crunchy, nutty and salty.   a nice touch of BBQ flavor",3,expected it to have nuts and a bbq flavor and it did,its good as is
581,3,Its perfect crunchy level. Not too crunchy,4,I wasn’t expecting it to taste good because of the odd combination.,"Perhaps try a different style of bbq, like hickory style"
623,3,Again. Just an odd flavor that isn’t for me,4,"It’s just a odd, unique flavor. I wasn’t expecting it to be delicious",Perhaps try a different BBQ type besides smoky
802,3,"Its consistent with other nature valley bars. A crunchy but fresh taste, despite not loving the flavor",4,Didn’t have high expectations for a smoky barbecue flavor but its Nature Valley quality,"Try something besides smoky, maybe honey bbq"
581,3,the nuts and seeds and seems somewhat healthy. It has a good crunch,2,It is not like a bbq chip and the flavor just didn't seem to go well with the mouth feel,I'm not a fan of the bbq flavor. it kind of clashes for what I like it a bar
623,6,the taste is the best of the 3. the crunch and contents are good,3,it was ok. had a decent bbq flavor and wasn't overpowering,not a fan of the bbq flavor. it is confusing taste with the texture. The cheese may be better
802,5,"good crunch, has some healthy ingredients",2,it just wasn't a good flavor or taste to me. It was a conflicting taste mixture and texture,not a fan of the bbq flavor but it was better than the first one
581,3,It has a nice crunch. I like the smokey taste,2,I can taste the bbq flavor but I think the savoriness needs to be ramped up with a touch more salt. It's almost too sweet to be savory,I think it needs a tad more salt.
623,4,"The crunch is firm, the smokiness is nice. The flavors from the nuts comes through",2,"It does taste like bbq and leans more towards savory, but I think the bbq flavor could be more obvious and be more savory.",The bbq flavor is a bit muddled. There needs to be more smoke and a tad more salt.
802,7,"The bbq flavor is very clear and obvious. I wish there was a tad bit more salt but the bbq flavor is very obvious, which I love. Less sweetness, which helps this bar taste more savory",3,"It actually fell below my expectations every so slightly, but it's close enough to being acceptable. The bbq flavor is clear, it's clearly a savory snack, and the crunch is firm and delicious.","It just needs a tiny bit more salt. A little tartness would brighten up the flavor, too."
581,9,"I've never had a BBQ style nature valley bar. It's completely unique compared to other products of this type. I'm surprised how well it worked. The prominent ingredients I sense are the roasted peanuts, the sunflower seeds, and almonds, and I love those. The BBQ flavor and aftertaste I wonderful and really set it apart.",5,"I had no idea what I BBQ flavor Nature valley bar would taste like, because I normally buy their basic flavors. I wasn't sure if it would work, but it really does!",Nothing really. I already want to buy a box.
