product_code,liking,liking_free_text,meets_expectation,meets_expectation_free_text,product_improvement_free_text
581,8,The taste lasts longer than normal,3,"The name smoky BBQ comes with a level of expectations and being from the south raised around BBQ pits, smokers and BBQ sauce so when i'm presented with a food that's called smoky BBQ i expect to have flash backs to when i was a kid growing up in the south and it defiantly delivered.",Nothing
623,8,The taste last longer than usual,4,See pryer,Nothing but i hope you plan on changing out the white packaging
802,8,Like before the taste last longer for some reason.,3,The best way to say this is the taste matched the name.,There's not enough so make the sizes bigger.
581,8,"I like that its different than most low calorie snack bars in the sense that those are usually sweet. The savory is a nice change of pace.  I like that the main ingredients are visible and gives a chunky texture and not pieced and soft.  I like the flavor, it doesn't start right away and it hits you in the back end.  The flavor stays with you, so I think that could help with cravings for wanting to eat more.",4,"I was expecting more of a peanut only flavor.I know thats the main ingredient, but the other ingredients and the flavoring are what makes  it better","It matches the stereotypical joke about Nature Valley in the sense that the bars are messy.  I found pieces in my shirt, table and floor after taking a bite, and I'm not typically a messy eater.  The color makes me question what holds the bar together.  I like a little more flavor than most, so I wonder if you could offer a bold and spicy pack and a regular pack"
623,8,"I like that it is different than most bars because it is savory rather than sweet. I like that the main ingredients are identifiable, I like that the flavor lasts to probably help with cravings and wanting to eat more.",4,The flavor is better than I thought it would be.  I have eaten savory  diet  bars from a weight loss company before and they tasted like metal and not good.,Its extremely crumbly and messy.  I would like to see it not fall apart so easily when you take a bite
802,8,"I like the flavor and how it lasts for a bit, I like how the ingredients are identifiable, I like the crunchy texture, I like that its different than most bars",4,"The flavor was good, better than I thought it would be. It leaves a good after flavor. I thought it would taste most like peanuts, but it didn't, and that was a nice surprise.  I buy flavored nuts and this bar would be nice to add to the variety of my snacks","Its too messy, I think if it was a little less hard/ crunchy it would help it not get everywhere"
581,6,I like the taste and aftertaste of bbq.,3,I went into study knowing this wouldn't be an overly sweet granola bar.,slightly sweeter
623,6,strong bbq taste,3,product seems like what I would imagine a savory granola bar would taste like,slightly sweeter
802,6,sweetest of the 3 products,3,"nice size, taste, and crunchiness",n/a
581,7,"I like the immediate salty taste and the texture overall. There is a nice warm/hot aftertaste that isn't too strong but suggests the BBQ flavor. It isn't TOO hard (as some similar bars are), so it is both easy to bite and chew.",4,I'm really digging the texture. I eat a lot of nature valley granola bars and I think I prefer this texture (a little less hard and crunchy). The BBQ is there and it remains me a bit of it on potato chips. I might want the flavor to be a little more clear but it was the only one of the three that captured what I'm looking for in this  new  product type.,"I want a little more immediate, upfront BBQ flavor. My preference would be leaning it toward the sweet spectrum, maybe a bit of a honey flavor. I like this bar best since the flavor was more noticeable, but I tend to like the sweeter BBQ flavors over the hot (so like Honey BBQ chips over spicy BBQ)"
623,5,I think the texture and crunch is pretty nice. There is a little  heat  after tasting that I kind of enjoy.,2,"I feel the promise of the flavor wasn't there enough. The texture and crunch was nice, better than the average bar, but only the salt was there enough to be  good  for me. I wanted a clearer BBQ taste.","The BBQ taste for me is only detectable in the aftertaste. I get a sense of salt and I like the texture, but the BBQ flavor is lost in the ingredients or the configuration. And then a bit later I have the aftertaste, which is kind of strong, but it makes me wish I had that flavor upfront in the original bite."
802,7,"This one is a bit more crunchy. It is at the edge of hardness. I wouldn't want it harder. The BBQ taste is a little more upfront, which I like. The texture and crunch is pretty nice overall.",3,I think the texture and ingredient taste is slightly above average and the BBQ at or slightly below expectation. It hints at what I wants but I feel the first product hits the mix a bit better.,"A little less crunchy (by like 5-10%), a little more upfront flavor but a little more sweet than hot. The hot aftertaste is just a tad higher than I would like. I would LOVE some honey or similar sweet flavor in there."
581,4,The crunch,2,The smoky taste is too over powering.,Less salty and too much of a flavor roller coaster.
623,3,The crunch of the bar.,2,The smoky flavor is too strong and the bar leaves a strange aftertaste in my mouth.,The flavor.
802,7,The crunch and the bar looks tasty.,3,The flavor is good but could be better.,The smoky flavor is still a little too strong; there’s more of a peanut butter flavor.
581,3,Its crunchy. Packaging makes its an easy snack for on the go. It is something unique that I've not had before. Flavor reminds me of bbq chips.,3,I didn't have expectations other than the label that it was BBQ. I enjoy bbq flavor sauce and chips so I was interested in trying.  I don't know that I would choose this product over a chip product.,The orange tint makes it look burnt. Breaks apart easily and is very messy.
623,6,I like the flavor better. reminds me of Lays bbq chips. The after taste hangs around more.  The peanuts in this one also have a dominant taste.,3,I compared it with the first trial I did so I had a better expectation this time.  I liked the lingering flavor of this bar.,The look of it.  The color of it is unnatural. It did fall apart more but I liked how it was softer to chew.
802,2,I do like the crunchiness. I also stayed together better and wasn't as messy.,1,The flavor is immediately gone.  It also doesn't have as much flavor as the other samples.,The appearance isn't appealing. The flavor doesn't linger at all.
581,7,The crunchiness and the taste.,3,From the first sight and the aroma it fit right where I thought it would be taste wise.,A little more sweetness maybe and the appearance is a bit drab.
623,6,I like the crunchiness and and the taste a little bit.,3,It just looked and tasted like I thought it was going to be.,Maybe a different appearance.
802,7,I liked the taste and texture of this one.,4,This one tasted a bit better to me than the last two.,A small change to appearance maybe.
581,9,What I like about this product is the flavors and texture of the ingredients and freshness.,3,The product met my expectations for the product because I was expecting a barbecue flavor that was not that strong.,I would add more flavors and combinations to people's liking.
623,4,The product was too hard for my teeth I felt like they were going to break.,2,The product did not met my expectations because it's way too hard for my teeth,I would change the texture of it and how soft the product is
802,7,What I like about the product is the flavor and texture of it,4,The product met my expectations because it was really flavorful.,What I would change about the product would be the crunchiness I would make it more softer.
581,4,The savory bbq flavor and the crunch.,2,It was a bit too sweet,It was a bit too sweet.
623,8,The barbecue flavor and crunch when biting into the product.,4,It tastes even better than I had expected.,I don't think I would change anything about this product.
802,7,It has a great crunch,3,It tasted how I expected it to taste.,Maybe make it a bit more savory.
581,2,once chewed it becomes very creamy in your mouth and the flavor comes and goes and is not pleasing,1,the multitude of textures were too much,"The bar appears to be coated in something, not like a normal Nature Valley Granola Bar"
623,5,flavor is not overpowering,2,I think Nature Valley!  this is not that.  Looks more like a knock off,"Appearance, bar looks coated in something."
802,2,not much,1,I think of Nature Valley as a top healthy snack brand.  The flavor is not appealing at all,the flavor - too smoky and this one has the creamy texture when chewed too
581,8,I like the crunchiness of this bar. I like the taste of the nuts and smoky taste,4,I expect good things from Nature Valley. The product is good and crunchy with nuts and seeds,I don't think anything needs to be changed with this product
623,8,I like the taste and the smoky flavor I get with each bite. I also enjoy the crispy pieces that I taste with each bite,4,I thought it was going to be a bbq coating and it is a bbq seasoning. I actually like the dry season better,I think it might taste a little better with a cheese flavored added to it
802,7,I like the crunchiness and the look of the product. I can see it has nuts in it and that it healthy,3,It should have more nuts and more bbq flavor. It is a good product but I would like a variety of nuts,I think the taste is not that much of a bbq flavor.   I would maybe add some bigger nuts like almonds or pecans
581,6,this one was difficult to decide whether i liked or disliked at first.  i do like the tangy flavor of this bar after having more than the initial taste. i like the texture of the bar.,3,i figured it would have some tangy flavor. i expected it to be an orange tone in color. i expected it to be crunchy in texture.,i would tone down the zingy flavor a bit. It is a bit much at first but in the end i think it was ok.
623,2,i like the texture of the bar.,2,i expected more flavor to this i guess. it was just sort of  off  tasting to me.,i would make the taste more of a bbq flavor. i feel like it's bland
802,7,i like the initial flavor upon eating. i also like the aftertaste of this bar. i like the texture as well.,4,"i was pleasantly surprised that i enjoyed this bar as much as i did, after tasting the first 2 bars. this one was the best of the bunch. i was expecting to not like the flavor after the other 2, and especially after the one i had just prior to this one.",i dont know what i would do to improve upon this product. this bar was the best of the bars.
581,8,Crunchy and savory with a hint of sweetness.,5,It has good amount of BBQ flavor,Nothing
623,8,BBQ flavor,5,"Enjoy the crunchy and BBQ flavor, very unique",The bar is crumbly
802,9,Sweet and BBQ flavor very tasty,5,Its unique flavor makes me less guilty for eat it,stronger flavors of BBQ
581,7,I like the strong nut taste. The roasted peanuts are the first ingredient and I'm a big fan of peanuts. I like how the product does not fall apart as easily as other Nature Valley products I have had before.,4,"The shape, texture, and crunch are similar to what I would expect from a Nature Valley product. I rated it slightly better than expected since I enjoyed the peanuts throughout the product.",I would make it a more subdued bbq flavor.
623,7,I like the crunch and nutty taste.,3,The bar goes with Nature Valley and is what I would expect for this product. The flavor is good but just a little strong for me and could tone down a little.,A little less BBQ flavor and more nut flavor.
802,7,"The crunch, the nuttiness.",3,"The product has a similar look, shape, texture, and crunchiness as other Nature Valley products.",A little less BBQ flavor and more of the nut flavor.
581,3,Love that it has the familiarity of a nature valley bar—bbq flavor is a miss though—had a burnt after taste,2,Was expecting better bbq flavor,Better flavor
623,7,Bbq flavor is great—great crunch,3,Bbq flavor was great and still identifiable as a nature valley bar,After taste is a little too artificial/plasticky
802,7,Texture is great—this one has a bit of a spicy zip,3,Great crunch and not too hard; could definitely use more bbq flavor though,The taste is a little off—like chemical-y
581,9,The Appearance It has really good flavor. the way the peanuts are seasoned and the crunch,5,it was seasoned way better than I expected and tasted fresher than I expected it to taste,I would make it a little bit bigger or have two bars per pack
623,9,The Appearance. The Flavor and the way the bar and peanuts are seasoned.,5,I didnt expect it to be seasoned so well and be as fresh as it tasted,I would make the serving size bigger or add another bar to the package and make it a two bar pack
802,9,The appearance. The way The bar and peanuts are seasoned and the freshness I didnt expect it to taste so fresh,5,The freshness and the overall taste,I would make the bar a little bit bigger or offer it as a two bar pack
581,6,"the BBQ flavor, it's not over powering",4,I did not thing that a BBQ Granola Bar would be any good,a little sweeter and little spicer flavor
623,7,The BBQ flavor had a little bit of spice to it,5,"Again, I just didn't think BBQ and Granola would go well together",make it a little sweeter
802,4,the flavor is overpowering and leaves an after taste,3,"This was what I was expecting,  The BBQ overpowered the granola",make it sweeter
581,7,I like the flavor and crunchiness. It also has a salty finish to it that makes me want another bite.,3,I expected the crunchiness nature valley bars offer with bbq flavor and that's exactly what I got. I do like that they are not as messy as the originals.,I would leave it the same as it is honestly.
623,2,"nothing, its got flavor but its more plain to me",2,it didn't have much flavor,add more flavor
802,6,I don't really like it but I don't really hate it either. Its kinda in the middle.,2,it didn't meet my expectations didn't have much of a bbq flavor,more flavor
581,2,Its crunchy it has a nice crunchy texture thats it!,1,It expected the same taste as barbeque potatoe chips they usually nail it on the head with a bbq taste.  Its crunchy so I expected to have the same hit in my mouth.  It it alright but not in a good way I could barely swallow it,The overall taste it barely has a barbeque flavor.  It really taste like a bunch of seasonings that doesn't match well blended.
623,2,its crunchy,1,Its extremely unpleasant to taste,taste the seasoning blend needs a big improvement.
802,2,Its just plain nasty small amount of barbeque flavor,1,I was really expecting a real bbq in my mouth a cookout yet I received a boxing match.  Just a bunch of flavors fightings for a spot.,Add more barbeque flavor and less of whatever season blend chosen.  Use more of a KC Masterpiece or Sweet Baby Rays flavor
581,7,"I like that it has nuts and nature valley, in general, is good for you. It has an addictive savory flavor.",3,"The pictures that I saw before looked great, but the idea and flavor just aren't appealing. It tastes smokey and savory, but I wouldn't reach for this in the grocery store.","It may just be in my head, but bbq flavor doesn't fit in a bar for me. Perhaps tone the bbq down. It does make me want another bite, but I doubt I would purchase it. I feel like I would still grab chips instead of this healthy alternative."
623,3,The nuts and grains. It looks fine,3,I didn't expect it to taste great. Bbq-flavored nut crunch? The pictures looked good. The flavors aren't mixing well for me,Not include the bbq flavor
802,3,The nuts and grains. It's everything I would want out of a bar except for the flavor,2,"After several tries, The bbq flavor just doesn't work with the bar. It is tasty but I wouldn't purchase this","Less bbq flavor. I answered a question saying this is what I'd expect it to taste like, but it actually is a bit worse than I expected."
581,7,"has a good amount of BBQ sweetness. Like that it has peanuts and seeds as primary ingredients. a tad spicy. A good snack when you don't want a bunch of sugar, tho i may be wrong",4,i thought it would be all savory but the sweetness saved the day,a very tiny increase in sweetness and a litle less throat burn
623,6,Product is hearty with nuts and seeds. a slight BBQ sweetness and no throat burn,3,"that the savory would be pronounced, with bbq flavor",slight bit sweeter
802,7,"slightly sweet, bbq flavor is there and crunchy buts and seeds are great",3,"noticeably smoky, bbq, more savory than sweet","slightly less smoke, slightly more sweet"
581,7,"I like the bite of nuts and the bbq flavor. It's light and not over-powering. Very subtle, while tasting the seeds and wholesomeness it says it's providing! I like that!!",5,"I like how it was made savory, with a slight hint of sweet somewhere in there?  The bite and consistency is good.","I could do a little more flavor myself, more nuts.  The bar had started to crumble in packing by the time I opened it, but the level of crunch is perfect.  Too hard would be a downfall."
623,8,I like the taste and the texture is good. The lasting/after-bite makes me want more.,4,"I enjoy nature valley product already, to have the option to incorporate savory is very innovative on the company!",More nuts!
802,8,"I like the flavor and the savory bites, the seeds and nuts along with texture is a good balance.",4,"The packaging (plain white) didn't give me that Nature valley expectation of goodness, but it shine through like the rest of their products.","I believe it's goods as is, me personally could use more BBQ flavor.  But honestly, I think the light flavor makes you want to eat more!"
581,6,I like that you can see and taste the nuts and seeds in the product. The smokey BBQ flavor is subtle but detectable.,3,"I know what BBQ flavor tastes like, and this was about as expected.",Add just a touch of sweetness. Make it a tad less crumbly.
623,4,"I can see the seeds and nuts, which makes me think it's healthy.",2,It has a slightly burnt flavor and look to it. It is a little more crumbly than I had expected.,Cook it for a little less time. It tastes a little burnt.
802,7,The flavor is enjoyable. The nuts and seeds are visible. It seems to be cooked properly.,3,It tastes like smokey BBQ as I expected.,"Make it a tad less crunchy, and perhaps add a tiny bit of sweetness."
581,6,Was a little lacking in flavor,3,"I expected it to be a sort of bland, not really there flavor","Slightly more flavor needs to be added, not quiet as hard"
623,8,I really like the flavor of this one. It has a LOT of flavor and I tend to gravitate towards things with lots of flavor,5,"Even though it is nuts and a bar, it tastes just like BBQ. I would almost pick this over BBQ chips if they had little snack sized pieces",Nothing
802,4,It doesn't seem to have much flavor... This specific product showed up completely crushed and so it was hard to taste,2,Lacking in flavor to me,It doesn't seem to have been as hard as the other two
581,6,"Sort of subtle, almost like a Lay’s BBQ chip, definitely savory, good crunch",2,Too dry of an aftertaste,"A little too bitter - too much paprika or chili powder, very dry finish"
623,1,That there are seeds I can see,1,Just so gross! Wanted to love a BBQ taste but way too bitter or worchershire  sauce taste,"Bitter, too strong of a smell and a pungent flavor that is disgusting"
802,7,"Savory, BBQ flavor, crunchy, seeds",3,"Savory, not overly flavorful but still slightly Smokey and salty","Maybe a bit of cheesy flavor, like cheddar"
581,7,Tastes great,4,Great product,Nothing
623,7,Great texture,3,It just sounds great,Different color
802,7,Tastes great,3,Looks great,More crunch
581,8,I like the peanuts.  I like the crunch and the light barbecue taste.,3,"I expected a crunchy barbecue flavored peanut bar, and that is what I got.",Nothing
623,8,I like the crunch.  I like the barbecue flavor and the peanuts.,3,"I was expecting a crunchy barbecue flavored bar, and that is what I got.",Nothing
802,8,I like the crunch.  I like that they are made of peanuts.  I like the barbecue flavor.,3,"I expected a crunchy barbecue flavored peanut bar, and that is what I got.",Nothing
581,8,In my opinion very similar to 623 but I feel like this one has a bit of spice and not as much smokiness but the flavor is better,4,its very good and has a better texture but I still like 623 the best,a tad less crunchy and more bbq!!
623,9,It the perfect amount of crunch and has a really smokey bbq flavor and I love it,5,Certain bbq snacks ive tried can not perfect the bbq taste and I love the taste of this,add a little more flavor
802,4,"overall only the flavor and not really that, its too minimal that it seems like I'm just eating nuts",2,It seems like this bar is rock hard compared to the others and very minimal flavor,More flavor and less crunchy
581,7,Pleasant strong and bold taste. Spicy aftertaste. Crunch level was about right. Savory tasting,3,"Bar was savory and delicious. BBQ flavour was strong and bold, but not overpowering.","It was a little too sweet for my liking. I was looking for a savory bar, but this was sweet and salty."
623,7,"Savory. Good amount of spice and taste while eating. Pleasant spicy and smoky aftertaste. When eating, you can taste the nuts and high quality ingredients that are well seasoned into a crunch.",4,It's savory. It is nut based. And it's very crunchy. I was surprised at how tasty it is.,"I would like to taste to be stronger while eating. most of the pleasant taste comes as an after taaste, after I have swallowed the product.    In the look, i would make it more airy and less dense, to mimic more the nature valley crunchy bars. These bars look sloppily made."
802,8,"Stronger smoky taste during eating experience. The product also had a pleasant spicy kick aftertaste that is not too strong. The bar tastes wholesome with the nut flavors being noticeable, but not dominant.",5,"The bar was delicious. I was skeptical of a savory bar, however, this bar exceeded my expectations. It is very flavorful, with the BBQ smoky flavors very prominent but not overpowering.","I would like this product to be slightly crunchier, as well as change the look. The bar is very bland and orange colored."
581,3,good crunch,3,didnt expect much,make it more sweet
623,2,"its too salty, dont taste much flavor other than salt",3,i didnt think it would be good,add a lil more sweetness
802,3,its got good crunch,3,i didnt have good expectations about this,needs a lil more sweet
581,7,"Like the texture, variety and crunch",3,"Good taste, just a little too spicy","It’s a little too spicy. Also it’s a little wide - a longer, more narrow shape would be better."
623,8,"Texture, flavor, variety of ingredients",4,"I thought it might be weird, but the flavors actually go really well together. I’d be curious to see how it stacked up against barbecue chips.","It’s a little wide - a longer, more narrow shape would be better. Also this is the saltiest of the three, so lower the sodium. It definitely tastes unhealthy."
802,8,"Texture, variety of ingredients, flavor",4,"Flavor is good, definitely satisfies a savory need","It’s a little wide - a longer, more narrow shape would be better."
581,3,I expected the bar to be a combination of sweet and savory however there was only a presence of savory.,2,Too much smoky BBQ flavor but the crunchy/overall texture was perfect.,I would add a sweetness to the bar possibly more a of a sweet BBQ flavor.
623,1,I like the texture of the bar and that is very crunchy.,2,"The BBQ flavor is over powering, needs something to tone the flavor.",I would attempt to add a bit of sweetness to the bar.
802,4,The texture of the bar.,2,I expected the bar to be crunchy but not so much BBQ and smoky flavor.,Lower the BBQ flavor and a little sweetness.
581,7,"Textures of seeds and nuts, savory",4,Had nice crunch and overall barbeque flavor,"less salt, a little more sweetness"
623,8,"spicy, crunchy, savory flavors",4,Wasn't sure from the first glance I would enjoy it.  A bit one-note in appearance.,Maybe a little more textures or bigger chunks of nut
802,7,"crunchy, spices",3,Met the definition but did not wow me,"A little more diverse texture, color and flavor"
581,6,"Perfect size for a snack, color of the product, and texture. It had a great mouth feel.",4,"Peanut flavor is much too overpowering. The bar is on the right track. Less peanut, a pinch more BBQ and it would be perfect.",The peanut flavor is overpowering that it's hard to find the BBQ flavor. It's very odd. My first bite all I tasted was peanut. After a few bites I tasted the BBQ flavor.
623,6,Perfect amount of crunch and mouth feel. It was crunchy but not too crunchy. I liked how the product was easy to hold and didn't fall apart.,2,The BBQ flavor was extremely overpowering. I didn't like how the product made my mouth taste like BBQ for a while afterward.,The BBQ flavor is way too strong!!!! It's overwheelming
802,6,The product has a great texture and mouth feel.  The BBQ flavor is almost about right. I think it is still slightly a bit strong especially for a bar.,4,The flavor is almost there but still a bit strong. It's hard to really saw how well it met my expectations since there is nothing like it on the market currently. I think that's what's making this hardered.,Tone down the BBQ flavor. It's a bit munch.
581,6,It's crunchy and savory,2,It's not bbq enough.  It gives a hint but not enough.,More bbq.  It seems like it has less of a punch of the bbq flavor than the others.
623,8,I like the crunch and the bbq flavor that hits after a few seconds.,3,It tastes like the regular version at first and then the bbq kicks in.  I expected it to taste like bbq and it does,Stronger bbq flavor upfront
