product_code,liking,liking_free_text,meets_expectation,meets_expectation_free_text,product_improvement_free_text
802,8,I like the strong bbq flavor that's left as an aftertaste and I like the crunchiness.  It would be a good salty craving snack.,3,It's a crunchy bbq snack just like I expected.  I'm definitely left with the bbq flavor in my mouth as expected.,I like the bbq flavor but it takes time to kick in.  I would like more bbq flavor upfront
581,5,The crunchyness of the product i like and its not has an overly strong bbq flavor.,3,The texture and hardness of the granola bar is what I was expecting from a product like this .,The bar could be slightly harder or crunchier.
623,4,I like that it is crunchy and i enjoy the texture,2,It was crunchy and tasted like a granola bar,I think the bbq flavor is very strong and different to this type of texture and flavor
802,5,I like the crunchyness of the product,2,The product met my expectation with the good texture of the granola bar.,The bbq flavor is off putting but not as strong on this sample
581,3,it's a bit better than previous 2,2,it's still bad. Just doesn't taste good.,taste
623,3,nothing,1,I love bbq potato chips. But this is simply bad.,"I honestly have no idea, It's just bad"
802,2,nothing,1,It tastes awfully,taste
581,8,nice well rounded flavor. works well together,5,flavors worked very well together. just the right amount of all,maybe just a little sweeter
623,7,liked the smokey taste. it was different,4,usually people add too much smoke flavor and it tastes like a grill,"maybe a slight bit sweeter. sweet, salty and smoke go well together"
802,7,nice smoke flavor. not as much as other one. maybe a little sweeter,4,sometimes getting the smoke flavor right is hard to do.,make a little sweeter
581,8,"The flavor is extremely well balanced. It is a satisfying snack that has the right combination of textures as well. Crunchy granola bars are expected to be a little bit crumbly, but this product holds together well and only a little sunflower seed fell off when I took my next bite. This made me feel like I was eating a wholesome bar with more natural ingredients rather than a mystery mash.",4,"The bar is thicker than I expected for the nature valley two slim bars packed together. It makes it more substantial and filling. The flavors are introduced to the tasting palette in a desirable and satisfying way. After the first two snack tests, I wasn't sure I was going to love any of the three, but this bar leaves me wishing I had more.","This bar hits a lot of my snacking ideals, I don't think any changes would necessarily improve it. There could be variations of sweet barbecue, spicy barbecue and just this current version as the standard base barbecue."
623,7,"It has a balanced, satisfying flavor. It isn't too hard on the teeth to chew and it reminds me of a more substantial barbecue chip. It would be more filling than a bag of chips but offers the same flavor, so would satiate an appetite more effectively.",3,"It has a barbecue flavor and the peanuts are visible. I was expecting a crunch and at first bite, this bar provided it.","My bar was quite crumbled despite being shipped in a box with packaging paper. Furthermore, the product fell apart more readily in my mouth when chewing. This isn't necessarily a bad thing, as flavor can be distributed more effectively, but it was unexpected for a crunchy granola bar. I'm more used to feeling the texture of the ingredients when chewing a bar and this felt more airy or buttery."
802,4,The crunch factor is very satisfying. This product has a good texture and allows for an adequate amount of chewing. It stayed in a bar shaped and you can visually see the composition of nuts.,2,I was expecting more of a barbecue flavor. Onion and barbecue usually work in conjunction with one another but I'd describe this bar as more of a  smoky onion barbecue  than a  smoky barbecue with onion,"The onion flavor is overpowering. It is initially very strong and supersedes the anticipated barbecue flavor. While chewing, the bar begins to taste more like a peanut but the after flavor is again more like an onion."
581,8,"While it is crunchy, does seem easier to chew.",4,"It was crunchy but not sure I'd describe it as hard.  Adding a savory flavor to a granola bar seems like a good idea, but one I hadn't tried before.",Slightly more BBQ flavoring.
623,7,"I like the BBQ flavor, but there is a weird after-taste that I cannot quite describe.",3,I wasn't really sure what to expect for a product like this.  I thought the flavoring was decent to my taste and so fit expectations.,A little stronger BBQ flavoring.
802,8,I didn't have a weird after-taste.  I also liked the flavor of the BBQ.,4,I haven't had a BBQ bar before this taste test.  This was better than I expected.,A little less hard/crunchy.
581,4,The same thing as the others. I like the peanut butter taste and the crunchiness.,2,I just expected it to have more of an enjoyable flavor.,"Less peanut butter, more BBQ. Or more of a meaty taste."
623,4,The sunflower seeds.,2,I didn't really like the flavor. The peanut butter flavor was more smoky and I didn't like it.,Not so much of a peanut butter flavor and more of BBQ.
802,4,I liked the crunch to it and also some of the peanut butter flavor.,2,I thought it would taste more like BBQ and not so much of peanut butter.,"More smoky taste, less peanut butter."
581,7,This sample was a lot crunchier than the second one I tried which is a lot better already. It also does not leave any after taste.,3,Th crunchiness of this bar was spot on and had a good consistency. It did not break off as easily and stayed solid through the whole tasting.,This sample did have a bit more seasoning as well but it wasn’t overpowering.
623,8,This product is actually amazing and the flavor profile is definitely there. I’m always looking for a healthier alternative to bbq chips or something crunchy with flavor and this hit the spot just right. The aftertaste wasn’t as bad as I expected either.,4,I wasn’t expecting the flavor to be as amazing as it was specially icoming from nature valley. It was very bbq flavored which I love.,I think the only thing I would change about it would be the amount of crunchiness because I made a bit of a mess.
802,7,"I really like how it looks however, it looks as if it has too much “seasoning” if that makes sense.",3,Nature valley is usually this crunchy and stable as far as a bar goes but not in color of course. It also does look a lot more shinnier than regular bars.,I think will change the way the product looks on the outside and how it’s covered in kind of coloring.
581,8,i like the flavors i can taste nuts sunflowers and the BBQ all at the same time so like that. that it taste different.,5,well never taste it anything like it. the taste is different and i liked how different but good it is.,I would make the BBQ less strong and also the hardiness a little more softers.
623,8,I like that it taste like smokey BBQ and also because is really crunchy and also because i can taste the peanuts and sunflower,4,I think this product is unique and taste really good did not thought it was gonna be that good and different.,i would make the BBQ less strong
802,8,like that it different and i like that it taste like BBq and also like that is crunchy,4,never taste something like this but it taste actually really good,i would just change the strong of the BBQ
581,9,I like the look and the crunch. I also enjoy the bbq taste with the peanuts. This is something new and different for me and I see myself always buying this.,5,It’s new and different and the combination of bbq and peanuts together taste great.,I wouldn’t change a thing.
623,9,"I love the crunch, bbq taste. I love that it has sunflower seeds and peanuts giving my tastebuds a different experience.",5,This is new and different and because you read bbq you think it will not taste good with peanuts but that wasent the case,I wouldn’t change anything about this product it’s perfect as is.
802,9,Love the crunchiness of the bar. I love the bbq taste the peanuts and sunflower seeds,5,This is new and different I love the bbq taste on a bar,I wouldn’t change a thing
581,7,I like the taste of this one.  All flavors and ingredients are just right.,5,I like this one and it taste much better than the other two,"Nothing, it is just right"
623,2,I do not like anything about it.,1,"I do not like the taste, the appearance and the flavors a confusing.",I do not like the taste of the product and its just confusing to me to eat BBQ in a bar.
802,6,The bbq taste is not as strong as the other one and it taste pretty good.,4,My answer is based on tasting this sample and the other bbq one.  This product is a little better that the other one and I like that it has less bbq and salty flavor.,I am not sure what to change to make it better but I like it a little bit.
581,9,the flavor and crunch,4,It has a nice crunch and just enough savory and sweetness,It has a little of an aftertaste
623,9,Its sweet yet savory and i love the crunch,5,I usually don't like sweet and savory things together but this is delicious,nothing
802,4,appearance and crunch,2,I expected it to not have an aftertaste,too much barbeque flavor and has an unpleasant aftertaste
581,5,I like the crunch and that is is unique but it isn't memorable for me.,2,"It doesn't have enough of the smoky BBQ flavor, in my opinion",It is lacking in the smoky BBQ flavor
623,4,"I like the smokiness and the crunch. I like that I can see the ingredients used, too.",3,I was expecting it to be different and slightly unfulfilling from the smoky BBQ angle.,"It tastes like it's missing something. Almost like this is what I would eat if I really wanted BBQ chips but I'm trying to eat healthier. I'd eat it, but I wouldn't be happy about it and I'd probably end up eating the chips anyway. Lol."
802,7,I like the salty/sweet combo. The BBQ flavor is present in a good way as well. Very satisfying.,5,"I was expecting it to be lackluster but this version is smoky, slightly sweet, savory, and the taste afterwards is good.",Can't think of anything I'd change; this one is good.
581,5,Flavor was pretty good,3,Did not really know what to expect,Less crunchy
623,3,Crunchy with a slight BBQ taste,2,"Wasn't what I was expecting, had a very confusing taste",Make it sweeter
802,3,"Crunchy, good nutty flavor",3,I didn't really know what to expect although the BBQ flavor was not very strong.  Was more of a nutty flavor,Make the flavor stronger
581,9,I love the savory taste. You taste a hint of barbeque and a very nutty flavor.,5,The flavor is amazing. You taste a hint of bbq and  a nutty flavor. It goes very well together.,I would just make it a little bit softer.
623,9,I love the flavors of barbeque and peanuts. They blend together nicely. It is also not too hard to bite into.,5,I love the crunchiness and the flavors. I love the barbeque and nutty flavors.  It is also not too hard to bite into.,I would just make this product a bit larger.
802,9,I love the barbeque flavor. I love that you can see and taste the peanuts in bar.,5,"I thought the barbeque flavor was going to be really strong and overpowering, but it was a great smoky flavor. I wanted to keep eating the bar.",I would also make a softer version of this bar.
581,2,"Very crunchy, slightly softer.  Good appearance.  Can see and taste more of the nuts in this one.",2,Not nearly enough flavor.  Kind of a flavorless bar.,Needs more flavor.
623,8,"Good amount of flavor.  This is my favorite of the 3.  It may be the softest.  No residue on hands.  The flavor is not over-powering like the first one, and has more flavor than the second one.",4,It has a smoky BBQ taste.  You can taste the nuts as well.,"Needs a little bit more flavor, like 10-20 percent stronger."
802,4,"Very crunchy, strong flavor.",2,"It has the most flavor of the three bars, but perhaps too much.  The after taste is over-powering, and I am concerned about my breath now.",Strong after taste.  I would be looking for a mint or mouthwash after finishing it.
581,7,I am a big bbq fan of practically everything and this has a distinct smoked bbq taste the aftertaste is very firm and constant,4,"i don't normally associate a nature valley crunchy snack/breakfast bar with bbq rather peanut butter, almonds, and granola. I thought the initial thought of a bbq bar was sort of gross, but it really blew away my very low expectations",nothing substantial comes to mind. maybe a darker color to which I associate bbq being
623,7,The consistent aftertaste and texture,4,I don't normally put this combo together via bbq and a granola bar,nothing comes to mind
802,7,It leaves a similar after taste compared to a BBQ chip,4,i think of a breakfast bar and BBQ is not a flavor that I am used to with a NV bar,nothing comes to mind
581,9,Great sweet and salty taste.,5,Product  was the right balance between each flavor; wasn't too salty or too sweet. Didn't have any lingering aftertaste.,I wouldn't make any changes to this product.
623,8,The first bite has a subtle BBQ flavor and the salty/savory flavor is released after chewing. There's a sweet aftertaste.,4,"I wasn't expecting the first bite to have such an enjoyable, subtle, BBQ flavor. I anticipated that it was going to be overwhelming and have a lingering aftertaste, however it did not.",I would use cashews instead of peanuts.
802,2,I like the hint of BBQ flavor you taste after the initial bite.,2,"I was expecting a sweeter BBQ flavor, not something so close to tasting like charcoal. It was a burnt flavor to it.","The smokey taste, and the lingering aftertaste, are not appealing. I would enjoy the BBQ flavor without the smokiness. The bar tastes as if it's been burnt/spent too much time on the grill."
581,9,"It's very flavorful. Much more savory than sweet. The crunch and texture is unexpected because the bar is on the thinner side, but I really like it",5,It packs serious flavor in a small bite. Looking at it at first I really didn't expect it,Maybe make it a touch more salty.
623,9,It's very savory and full of flavor. It's crunchier than I expected.,5,The flavor is really amazing. Small bite packs lots of flavor,Make a bar a little bigger
802,9,"It's very flavorful, crunchy, sweet and savory at once. I like the texture too. It's not as hard as it looks to be originally but it has a good crunch",5,"The product doesn't look like it'll pack as much flavor as it actually does. It looks appetizing, but I didn't expect that much flavor to come through","I like that its sweet and savory, but after taking another bite I'm looking for more savory than sweet. Maybe very slightly tone down sweetness"
581,2,I like the size and the fact that you could see the seeds in it,2,I thought it would be sweeter and more savory,The overall taste
623,7,It has a sweet taste to it,3,The size and the sweet taste how get when eating it was great,I think adding a little more nut taste with this one would make the flavor better
802,3,I like that is bar and the right size,2,I did not like the BBQ flavoring . It did not mix well with the nut taste,Make it more sweet
581,4,i didn't really like it. flavor wasn't good to me,2,i didn't like the flavor,better flavor
623,6,not great flavor,2,i didn't like the flavor,better flavor
802,7,it has pretty decent flavor  crunchy  not very salty to me,4,"flavor is better than i expected, but could be better, i think","it has good flavor, but i think it could be a bit bolder"
581,7,Flavor and consistency,4,Crunchy and appetizing,Nothing
623,7,Flavor and consistency,3,The flavor matches,Nothing
802,7,bbq flavor is unique,3,Because it tastes the way it is described,"nothing, it's flavorful"
581,6,The bar was great tasting it just didn’t taste as much like barbecue as I would’ve liked. I liked the strong roasted nut flavor but I would’ve liked a stronger barbecue flavor. The overall taste and aftertaste was good it was still enjoyable.,2,"The flavor was good, but the barbecue left a little to be desired.",More barbecue I would’ve liked. The bar wasn’t as robust as the previous bar where I liked the strong flavor. Adding more spice or flavor to get a fuller first bite is what I recommend.
623,7,"The bar has a unique taste, it has a strong barbecue taste but also strong roasted nut taste. I like the appetizing flavor and after taste. The bar isn't too much of either and I can take multiple bites and still want more.",3,I tasted the barbecue and nut crunch as advertised. The bar delivered on the flavor and is unique.,I would increase the barbecue flavor and strengthen the after taste. This would make the flavor more bold and craveable. The first bite is a bit flat and I think more barbecue flavor can fix that.
802,8,I like the strong barbecue flavor and the nutty texture the bar has. It’s flavor is strong and hits you immediately. I also like the aftertaste it tastes like bbq ribs and it lasts a long time. I enjoyed this bar very much.,5,I didn’t expect the taste to be as strong as it was but was pleasantly surprised. This bar met the goal of combining a barbecue and nutty taste that can satisfy a craving and have an enjoyable taste that makes you want more.,If I could change something I would make it a bit softer because it breaks apart easily.
581,5,The subtle hint of bbq,3,The crunch and appearance are as I expected them to be.,"Maybe adding more bbq, the flavor is fine. There just needs to be more bbq"
623,1,The crunch,1,The crunch and appearance,The taste of this I very weird and leaves a nasty aftertaste. It’d like a smoky bbq but not a good one. When you first bite it you don’t get any flavor. It’s only in the aftertaste.
802,4,This product taste the most like BBQ of the three and has a nice crunch.,3,This has a mesquite bbq taste and that’s what I thought it’d taste like based on the smell and ingredients.,Having more of the BBQ taste and a little more sweetness.
581,6,The balance of the flavor was too off and it was too salty.,2,It was too salty for my liking and did not have a good balance of flavor,It would be better if it was less salty
623,7,This one had a better balance of sweet and savory and the crunch was tasty.,3,It was just as I expect with the balance of flavor and crunch,I would make the biscuit a bit thicker
802,8,I like the sweet and savory taste of BBQ for this bar. It is a good balance of flavors and is enjoyable.,3,It was the flavor and the balance of crunch and sweet I was expecting,I would dial down on the smoke flavor .
581,8,I like the mixture of the bbq flavor and nuts,4,Its very yummy and a great combination of flavors,I would maybe leave the nuts in bigger pieces.
623,9,I love the bbq flavor,5,The flavor combination is amazing and has such a good texture,nothing. I think it's perfect
802,8,I really enjoyed the savory flavor.  There is a great combination of nutty flavor and bbq flavor,4,I didn't really have a solid expectation when thinking of a granola bar.. but this is like a trail mix or bar mix. So yummy,I think I would add a bit more of the bbq flavor
581,3,I did not like this product it was sweet and savory and the taste was off,1,It has a sweet hint,Can this product and use the first sample or last sample
623,7,Good flavor tastes almost identical to sample 1,4,I was expecting it to taste bad but it was much better than I anticipated,Maybe less onion powder
802,6,Its savory the flavors and scent are over powering I am not sure if I would want to eat this on the go,4,I really can taste the bbq flavor. Reminds me of bbq potato chips,Somehow mask the scent more I feel like my breath smells now
581,8,I like the light BBQ flavor and the crunchiness.,4,I was not expecting it to taste so good because i have never a savory type of crunchy bar.,"Maybe a little sweeter, like a sweet light BBQ flavor."
623,8,I like the BBQ flavor and the sweetness. Its a little more sweeter than the other bars.,4,I dont taste any smoky-ness flavor,"It has less BBQ flavor, so maybe a stronger BBQ flavor."
802,8,I like the BBQ Flavor. I like that it is savory. I like the crunchiness.,4,i honestly thought it might be nasty as i have never had a savory type of crunchy bar.,Maybe a little more sweeter as i like sweet BBQ flavors.
581,4,The crunchiness,2,It didn’t really have a good taste to it,The flavor is off
623,6,It’s crunchy and savory,4,It’s surprisingly very  wholesome and tasty,Add a little sweet
802,7,The savory the bbq flavor really stands out and the crunchiness,4,I expected it to be nasty because when you think nature valley u don’t  Think savory but this reminded me of eating a bag of bbq chips  Or bbq chicken very wholesome,Mayb the appearance Mayb add a little sweet but with the bbq flavor very present
581,7,"nice crunch, not too strong of a bbq flavor",4,i enjoyed the bar,nothing
623,4,A little too strong of a bbq smell,2,thought the flavor would be more nutty,cut the bbq flavor
802,3,Don't like the bbq flavor. It has a weird aftertaste,2,found the flavor very fake,discontinue it
581,8,I like the flavor and the crunch. Doesn't have as much smoky flavor as the previous bar and not as strong of an aftertaste.,2,It is a very light smoke and bbq flavor not very strong or bold.,"I would add more BBQ flavoring in, it seams like its missing a little bit."
623,7,"Not a very strong flavor, could use more smoke and BBQ",2,It isn't as flavorful after having a few bites. NO good lingering aftertaste either,"Add more flavoring either stronger BBQ and/or smoke, probably both"
802,8,"I love the smoky flavor, it stays with you for awhile. It's not spicy but I taste a small amount of heat. Good crunch",5,It has an overall great combo of flavor of smoke and BBQ. not over bearing and long lasting aftertaste that makes me want to take another bite,Nothing I believe this one is my favorite.
581,6,I like the BBQ that is left in my mouth after I finish eating it as well as the peanuts and texture.,2,"Again, this one had a bit of a sweet aftertaste to it, which overwhelmed the BBQ flavor.","I feel like it's too sweet, I wish it was more savory. I can see myself feeling sick afterwards."
623,7,i like that it has a very savory and smokey taste. There is no sweet aftertaste.,3,The taste matches the name and the level of BBQ I can taste in the bar. It's not too overpowering.,I really don't like how it's so crumbly
802,8,"I like the texture of the peanuts and seeds. I also like the smokey BBQ flavoring. It has a nice aftertaste, and I like the crunch of the peanuts.",4,"I have eaten several Nature Valley granola bars in the past, and they have all been very sweet. It was very unexpected for it to have such a savory taste. It's not what I would normally expect from the brand.","It's very crumbly, and it makes quite a mess. Otherwise, I think it's an interesting take on the Nature Valley brand."
581,7,I enjoyed the crunch to this one and it was more dense than the previous so I like that. I like the overall barbecue flavor because it did have a nice sweetness to it and it seemed like it had more nuts which was a good thing for me. Overall it had a good balance of salty and sweet from the barbecue flavor,4,Thinking of Nature's Valley I think sweet and granola bars and this was a nice surprise with a good BBQ Jesus that was for Smokey and a sweep and had a nice crunch to it without being dry or too dense,Honestly for this product I can't think of anything that I would want to change except to maybe make it bigger because I would want more
623,6,I like that it has a nice crunch to it and there's more of a sweet barbecue flavor,3,It seems like a typical barbecue snack. The flavor itself is sort of generic and what I would expect. it's not something special that really stands out however,I feel like this one could definitely be denser because there is a nice crunch but then like the first one it crumbles a little. Also the barbecue flavor is a little too sweet for me
802,4,I like the crunch to it,2,"The BBQ taste was too intense and I didn't feel like it was a satisfying BBQ flavor. It was way too smokey in the flavor, so much so that it was overpowering and I couldn't taste anything else besides the smoke",It was too crumbly.  I expected it to be more crunchy but the bar just sort of crumbled in my mouth after taking a bite and it wasn't very dense. It seemed like it was going to be a solid crunchy kind of snack but was exactly the opposite so I would prefer to see it have a more solid consistency.
581,6,"The peanut flavor is good. It has less heat, so thats nice too.",2,I don't really taste the BBQ. It's more faint.,Stronger BBQ flavor without the heat that comes with it. The BBQ flavor seems to be much more subtle with this sample.
623,8,"This was the only sample not broken, but it just looks better. Better BBQ flavor, although it's a little too spicy.",4,Just impressive to impart this flavor in a nut bar. It's different.,More BBQ flavor less heat
802,8,"It's very unique, doesn't remind me of anything I've tasted before. I love the nutty smoky BBQ flavor.",4,"I don't gravitate towards smoky flavor because it tends to linger throughout the day, it's definitely smoky, but not how I anticipated.","It's very savory, a kick of sweet/acid or something could temper the kick of the smoky BBQ seasoning. If would be nice if the the peanuts had some kind of mildly sweet taste. I wasn't expecting it to be spicy."
581,3,The appearance. The product appears to be very appetizing.,3,"The flavor is missing something. I taste the smokiness; however, it is missing the BBQ.","The taste. There is not enough flavor on the product, to me."
623,5,I like the appearance of the product. The product appears as though it will be tasty.,3,The product is not as good as expected.,Add more sweetness to the taste.
